{
  "$schema": "https://json-schema.org/draft/2020-12/schema",
  "$id": "https://kristal.org/schemas/v3/claim-ir.schema.json",
  "title": "Claim-IR v3",
  "type": "object",
  "additionalProperties": false,
  "required": ["schema_version", "subject", "claims"],
  "properties": {
    "schema_version": {
      "type": "string",
      "const": "3.0"
    },

    "document": {
      "type": "object",
      "additionalProperties": false,
      "properties": {
        "doc_id": { "type": "string", "minLength": 1 },
        "title": { "type": "string" },
        "lang": { "$ref": "#/$defs/lang" },

        "source_url": { "type": "string", "format": "uri" },
        "source_id": { "type": "string", "minLength": 1 },

        "retrieved_at": { "type": "string", "format": "date-time" },
        "published_at": { "type": "string", "format": "date-time" },

        "content_hash": {
          "type": "object",
          "additionalProperties": false,
          "required": ["alg", "value"],
          "properties": {
            "alg": { "type": "string", "enum": ["sha256"] },
            "value": { "type": "string", "pattern": "^[0-9a-fA-F]{64}$" }
          }
        }
      },
      "anyOf": [
        { "required": ["source_url"] },
        { "required": ["source_id"] },
        { "required": ["doc_id"] }
      ]
    },

    "extraction": {
      "type": "object",
      "additionalProperties": false,
      "properties": {
        "run_id": { "type": "string", "minLength": 1 },
        "created_at": { "type": "string", "format": "date-time" },

        "producer": {
          "type": "object",
          "additionalProperties": false,
          "properties": {
            "kind": { "type": "string", "enum": ["llm", "rules", "hybrid", "human"] },
            "name": { "type": "string" },
            "version": { "type": "string" }
          }
        },

        "model": {
          "type": "object",
          "additionalProperties": false,
          "properties": {
            "provider": { "type": "string" },
            "name": { "type": "string" },
            "version": { "type": "string" }
          }
        },

        "prompt_ref": {
          "type": "object",
          "additionalProperties": false,
          "properties": {
            "prompt_id": { "type": "string" },
            "prompt_hash": { "type": "string", "pattern": "^[0-9a-fA-F]{64}$" }
          }
        },

        "notes": { "type": "string" }
      }
    },

    "subject": { "$ref": "#/$defs/entity_ref" },

    "claims": {
      "type": "array",
      "minItems": 0,
      "items": { "$ref": "#/$defs/claim" }
    },

    "warnings": {
      "type": "array",
      "items": { "$ref": "#/$defs/warning" }
    },

    "errors": {
      "type": "array",
      "items": { "$ref": "#/$defs/error" }
    }
  },

  "$defs": {
    "qid": { "type": "string", "pattern": "^Q[1-9][0-9]*$" },
    "pid": { "type": "string", "pattern": "^P[1-9][0-9]*$" },
    "lang": { "type": "string", "pattern": "^[a-z]{2}(-[A-Z]{2})?$" },

    "entity_candidate": {
      "type": "object",
      "additionalProperties": false,
      "required": ["id", "score"],
      "properties": {
        "id": { "$ref": "#/$defs/qid" },
        "score": { "type": "number", "minimum": 0, "maximum": 1 },
        "label": { "type": "string" },
        "source": { "type": "string" }
      }
    },

    "property_candidate": {
      "type": "object",
      "additionalProperties": false,
      "required": ["id", "score"],
      "properties": {
        "id": { "$ref": "#/$defs/pid" },
        "score": { "type": "number", "minimum": 0, "maximum": 1 },
        "label": { "type": "string" },
        "source": { "type": "string" }
      }
    },

    "entity_ref": {
      "type": "object",
      "additionalProperties": false,
      "properties": {
        "qid": { "$ref": "#/$defs/qid" },
        "surface": { "type": "string", "minLength": 1 },
        "lang": { "$ref": "#/$defs/lang" },
        "candidates": {
          "type": "array",
          "items": { "$ref": "#/$defs/entity_candidate" }
        }
      },
      "anyOf": [
        { "required": ["qid"] },
        { "required": ["surface"] }
      ]
    },

    "predicate_ref": {
      "type": "object",
      "additionalProperties": false,
      "properties": {
        "pid": { "$ref": "#/$defs/pid" },
        "surface": { "type": "string", "minLength": 1 },
        "lang": { "$ref": "#/$defs/lang" },
        "candidates": {
          "type": "array",
          "items": { "$ref": "#/$defs/property_candidate" }
        }
      },
      "anyOf": [
        { "required": ["pid"] },
        { "required": ["surface"] }
      ]
    },

    "object_value": {
      "type": "object",
      "additionalProperties": false,
      "required": ["kind", "value"],
      "properties": {
        "kind": {
          "type": "string",
          "enum": ["item", "string", "quantity", "time", "monolingual_text", "coord", "url"]
        },
        "value": {}
      },
      "allOf": [
        {
          "if": { "properties": { "kind": { "const": "item" } } },
          "then": { "properties": { "value": { "$ref": "#/$defs/entity_ref" } } }
        },
        {
          "if": { "properties": { "kind": { "const": "string" } } },
          "then": { "properties": { "value": { "type": "string" } } }
        },
        {
          "if": { "properties": { "kind": { "const": "url" } } },
          "then": { "properties": { "value": { "type": "string", "format": "uri" } } }
        },
        {
          "if": { "properties": { "kind": { "const": "quantity" } } },
          "then": {
            "properties": {
              "value": {
                "type": "object",
                "additionalProperties": false,
                "required": ["amount"],
                "properties": {
                  "amount": { "type": "number" },
                  "unit_qid": { "$ref": "#/$defs/qid" },
                  "lower_bound": { "type": "number" },
                  "upper_bound": { "type": "number" }
                }
              }
            }
          }
        },
        {
          "if": { "properties": { "kind": { "const": "time" } } },
          "then": {
            "properties": {
              "value": {
                "type": "object",
                "additionalProperties": false,
                "required": ["iso8601"],
                "properties": {
                  "iso8601": { "type": "string", "pattern": "^-?\\d{4}-\\d{2}-\\d{2}" },
                  "precision": {
                    "type": "string",
                    "enum": ["year", "month", "day", "hour", "minute", "second"]
                  },
                  "calendar": { "type": "string" },
                  "timezone": { "type": "string" }
                }
              }
            }
          }
        },
        {
          "if": { "properties": { "kind": { "const": "monolingual_text" } } },
          "then": {
            "properties": {
              "value": {
                "type": "object",
                "additionalProperties": false,
                "required": ["text", "lang"],
                "properties": {
                  "text": { "type": "string" },
                  "lang": { "$ref": "#/$defs/lang" }
                }
              }
            }
          }
        },
        {
          "if": { "properties": { "kind": { "const": "coord" } } },
          "then": {
            "properties": {
              "value": {
                "type": "object",
                "additionalProperties": false,
                "required": ["lat", "lon"],
                "properties": {
                  "lat": { "type": "number", "minimum": -90, "maximum": 90 },
                  "lon": { "type": "number", "minimum": -180, "maximum": 180 },
                  "globe": { "type": "string" }
                }
              }
            }
          }
        }
      ]
    },

    "evidence": {
      "type": "object",
      "additionalProperties": false,
      "required": ["source"],
      "properties": {
        "source": {
          "type": "object",
          "additionalProperties": false,
          "properties": {
            "source_id": { "type": "string", "minLength": 1 },
            "source_url": { "type": "string", "format": "uri" },
            "title": { "type": "string" },
            "retrieved_at": { "type": "string", "format": "date-time" }
          },
          "anyOf": [
            { "required": ["source_url"] },
            { "required": ["source_id"] }
          ]
        },
        "quote": { "type": "string" },
        "page": { "type": "integer", "minimum": 1 },

        "offsets": {
          "type": "object",
          "additionalProperties": false,
          "properties": {
            "start_char": { "type": "integer", "minimum": 0 },
            "end_char": { "type": "integer", "minimum": 0 }
          }
        },

        "selector": {
          "type": "object",
          "additionalProperties": false,
          "properties": {
            "kind": { "type": "string", "enum": ["css", "xpath", "json_pointer", "pdf_region"] },
            "value": { "type": "string", "minLength": 1 }
          }
        }
      }
    },

    "uncertainty": {
      "type": "object",
      "additionalProperties": false,
      "properties": {
        "confidence": { "type": "number", "minimum": 0, "maximum": 1 },
        "confidence_interval": {
          "type": "object",
          "additionalProperties": false,
          "required": ["low", "high"],
          "properties": {
            "low": { "type": "number", "minimum": 0, "maximum": 1 },
            "high": { "type": "number", "minimum": 0, "maximum": 1 }
          }
        },
        "method": { "type": "string" },
        "notes": { "type": "string" }
      }
    },

    "claim": {
      "type": "object",
      "additionalProperties": false,
      "required": ["predicate", "object"],
      "properties": {
        "claim_id": { "type": "string", "minLength": 1 },

        "predicate": { "$ref": "#/$defs/predicate_ref" },
        "object": { "$ref": "#/$defs/object_value" },

        "qualifiers": {
          "type": "array",
          "items": {
            "type": "object",
            "additionalProperties": false,
            "required": ["predicate", "object"],
            "properties": {
              "predicate": { "$ref": "#/$defs/predicate_ref" },
              "object": { "$ref": "#/$defs/object_value" }
            }
          }
        },

        "evidence": {
          "type": "array",
          "items": { "$ref": "#/$defs/evidence" }
        },

        "confidence": { "type": "number", "minimum": 0, "maximum": 1 },
        "uncertainty": { "$ref": "#/$defs/uncertainty" },

        "alternatives": {
          "type": "array",
          "items": { "$ref": "#/$defs/claim" }
        },

        "notes": { "type": "string" }
      }
    },

    "warning": {
      "type": "object",
      "additionalProperties": false,
      "required": ["code", "message"],
      "properties": {
        "code": {
          "type": "string",
          "enum": [
            "NO_CLAIMS_EXTRACTED",
            "LOW_CONFIDENCE_EXTRACTION",
            "AMBIGUOUS_SUBJECT",
            "AMBIGUOUS_PREDICATE",
            "UNRESOLVED_QID",
            "UNRESOLVED_PID",
            "EVIDENCE_MISSING",
            "EVIDENCE_WEAK",
            "VALUE_NORMALIZATION_NEEDED"
          ]
        },
        "message": { "type": "string" },
        "path": { "type": "string" }
      }
    },

    "error": {
      "type": "object",
      "additionalProperties": false,
      "required": ["code", "message"],
      "properties": {
        "code": {
          "type": "string",
          "enum": [
            "SCHEMA_INVALID",
            "REQUIRED_FIELD_MISSING",
            "UNSUPPORTED_KIND",
            "INVALID_VALUE_SHAPE"
          ]
        },
        "message": { "type": "string" },
        "path": { "type": "string" }
      }
    }
  }
}
